{
  "summary": "Pass — complete underscore-to-hyphen rename across 37 files with all blocking concerns resolved",
  "verdict": "pass",
  "rationale": "All 10 ACs met. Challenger blocking issue (CLAUDE.md line 39 product_authority) confirmed fixed — independent grep verification shows zero underscore agent types in CLAUDE.md and schemas. DA approved, QA approved, 68/68 tests pass, typecheck clean. Non-blocking debt (example files) tracked appropriately. Worker confidence 5/5 justified by evidence.",
  "version": "1.0",
  "agent": "product-authority",
  "task_id": "task-002",
  "role": "authority",
  "created_at": "2026-04-09T14:14:27Z"
}
