{
  "summary": "Fixed evolution.ts cwd bug (2 sites), removed v3 no-op functions, removed stale fallbacks, deduplicated readInputData",
  "files_changed": [
    "plugin/cli/src/commands/evolution.ts",
    "plugin/cli/src/commands/mission.ts",
    "plugin/cli/src/commands/health.ts",
    "plugin/cli/src/lib/post-write-checks.ts"
  ],
  "version": "1.0",
  "agent": "software_engineer",
  "task_id": "task-001",
  "role": "implementer",
  "created_at": "2026-04-09T13:05:19Z"
}
