{
  "summary": "Structural review passed. task-compiler uses scope.surfaces correctly, routing table uses valid agentType enum values (software-engineer, qa-engineer, etc.), verify-fix-loop evidence paths are correct, specifying.md rubric dimension name core_interaction is correct.",
  "verdict": "approved",
  "concerns": [],
  "version": "1.0",
  "agent": "design-authority-review",
  "task_id": "task-003",
  "role": "reviewer",
  "created_at": "2026-04-09T14:23:12Z"
}
