{
  "summary": "Build 68/68 pass. plugin/skills/help/SKILL.md exists. Verified.",
  "verdict": "pass",
  "criteria_results": [
    {
      "criterion": "help_skill_exists",
      "passed": true
    },
    {
      "criterion": "build_and_tests",
      "passed": true
    }
  ],
  "version": "1.0",
  "agent": "qa-engineer",
  "task_id": "task-006",
  "role": "tester",
  "created_at": "2026-04-09T14:22:35Z"
}
