{
  "summary": "help/SKILL.md created with correct frontmatter (name:help). Content covers commands, 4-phase workflow, agent model, key concepts. No incorrect external references.",
  "verdict": "approved",
  "concerns": [],
  "version": "1.0",
  "agent": "design-authority-review",
  "task_id": "task-006",
  "role": "reviewer",
  "created_at": "2026-04-09T14:23:16Z"
}
