{
  "summary": "Build 68/68 pass. scope.surfaces found in task-compiler/SKILL.md. Verified.",
  "verdict": "pass",
  "criteria_results": [
    {
      "criterion": "scope_surfaces_in_task_compiler",
      "passed": true
    },
    {
      "criterion": "build_and_tests",
      "passed": true
    }
  ],
  "version": "1.0",
  "agent": "qa-engineer",
  "task_id": "task-003",
  "role": "tester",
  "created_at": "2026-04-09T14:22:30Z"
}
