{
  "summary": "Tested geas schema command group (list + template). 10/12 test cases pass. Bug found: evidence template --role flag correctly adds conditional required fields but does not set the role field value in output -- all roles show role:implementer (first enum value). Invalid --role silently degrades instead of erroring. All other criteria pass: schema list returns 15 types, task-contract/design-brief/record templates correct, ref resolution works, self-ref handled, nonexistent type errors properly.",
  "verdict": "changes_requested",
  "criteria_results": [
    {
      "criterion": "schema list outputs all 15 types",
      "passed": true,
      "details": "Returns 15-element JSON array"
    },
    {
      "criterion": "template generates correct JSON with required fields",
      "passed": true,
      "details": "task-contract, design-brief, record all correct"
    },
    {
      "criterion": "ref resolution works",
      "passed": true,
      "details": "_defs.schema.json refs resolve correctly"
    },
    {
      "criterion": "self-ref handled",
      "passed": true,
      "details": "record schema #/$defs/tierResult code path exists and does not crash"
    },
    {
      "criterion": "conditional schemas with role",
      "passed": false,
      "details": "BUG: Conditional fields ARE added correctly (files_changed for implementer, verdict+concerns for reviewer, etc.) but role field value always shows implementer instead of the requested role. The --role flag does not override the role enum default."
    },
    {
      "criterion": "error on invalid type",
      "passed": true,
      "details": "nonexistent type exits 1 with JSON error listing available types"
    }
  ],
  "version": "1.0",
  "agent": "qa-engineer",
  "task_id": "task-001",
  "role": "tester",
  "created_at": "2026-04-10T14:18:38Z"
}
