{
  "summary": "Pass. Deprecated terms removed from both en/ko SKILLS.md files with verified consistency. Acceptance criteria fully met, design-authority approved, no blocking concerns.",
  "verdict": "pass",
  "rationale": "Low-risk terminology cleanup with complete verification. Setup descriptions updated, Absorption Reference sections removed. En/ko consistency confirmed. Minor debt item (vote-round Absorbed pattern) noted but out of scope.",
  "version": "1.0",
  "agent": "product-authority",
  "task_id": "task-002",
  "role": "authority",
  "created_at": "2026-04-10T13:09:49Z"
}
