{
  "summary": "One blocking concern found: CLAUDE.md line 39 still has product_authority (underscore) in the Verification Flow section despite CLAUDE.md being in the stated change set. Two non-blocking concerns: 10 protocol example JSON files retain underscore agent types, and the AC8 verification grep scope excluded docs/protocol/examples/.",
  "verdict": "changes_requested",
  "rationale": "The CLAUDE.md miss is blocking because it is within the declared scope -- the closure claims CLAUDE.md Agent Name Rule section was updated, but the Verification Flow section on line 39 was not. The example files concern is non-blocking but material: they are canonical protocol documentation and will cause confusion. The narrow grep scope concern is advisory for future verification design.",
  "version": "1.0",
  "agent": "challenger",
  "task_id": "task-002",
  "role": "authority",
  "created_at": "2026-04-09T14:12:54Z"
}
