{
  "summary": "Final verdict pass for task-002 (skills/agents stdin docs sweep). Closure complete, 7/7 ACs, gate pass, 3 reviewer approvals, stale-binary risk carried to task-003.",
  "verdict": "pass",
  "rationale": "All evidence aligns: grep-verified zero violations, rubric thresholds cleared (core 4/4, feature 5/4, quality 4/4, regression 5/5), non-goals honored, JSON semantics preserved byte-identically, allowed value-flag exceptions untouched. Known risk (docs ahead of bundled binary) is explicit and owned by task-003. Solves the stated problem of stale --data/--file documentation leading agents to copy broken examples.",
  "version": "1.0",
  "agent": "product-authority-verdict",
  "task_id": "task-002",
  "role": "authority",
  "created_at": "2026-04-11T12:26:16Z"
}
