{
  "summary": "Final verdict for task-002: PASS. Validation error hints feature is complete, backward-compatible, and solves a real usability gap. All reviewers aligned.",
  "verdict": "pass",
  "rationale": "Complete closure packet with all 5 ACs verified. Design authority and QA both approved. Additive change preserves backward compatibility. Known  limitation is documented and degrades gracefully. Worker confidence 4/5. This feature directly improves CLI usability by giving users actionable guidance when validation fails.",
  "version": "1.0",
  "agent": "product-authority-verdict",
  "task_id": "task-002",
  "role": "authority",
  "created_at": "2026-04-10T14:31:24Z"
}
