{
  "summary": "No user-facing documentation changes needed — mission only affected internal skill instructions and reference docs. README unchanged.",
  "files_changed": [],
  "version": "1.0",
  "agent": "technical-writer",
  "task_id": "polishing",
  "role": "implementer",
  "created_at": "2026-04-10T13:11:24Z"
}
