{
  "summary": "Synced skills with current schemas: scope.paths->scope.surfaces in task-compiler JSON example, slot names->concrete agentType enum values (software-engineer, qa-engineer, etc.) in routing table and example, fixed evidence path in verify-fix-loop to use generic reviewer pattern, corrected output_quality->code_quality dimension name in specifying.md",
  "files_changed": [
    "plugin/skills/task-compiler/SKILL.md",
    "plugin/skills/verify-fix-loop/SKILL.md",
    "plugin/skills/mission/references/specifying.md"
  ],
  "version": "1.0",
  "agent": "software-engineer",
  "task_id": "task-003",
  "role": "implementer",
  "created_at": "2026-04-09T14:18:05Z"
}
