{
  "summary": "Final verdict: PASS. CLI path traversal defense task meets all acceptance criteria. 7 files hardened, 68/68 tests pass, all reviews approved, 3 non-blocking challenger concerns acknowledged as debt.",
  "verdict": "pass",
  "rationale": "The stated problem (unsecured CLI commands vulnerable to path traversal) is solved. validateIdentifier blocks traversal attempts at input, assertContainedIn provides defense-in-depth on output paths. Behavioral change from sanitization to rejection is correct security posture. Challenger concerns are valid follow-up items but do not block shipment of this scoped hardening.",
  "version": "1.0",
  "agent": "product-authority-verdict",
  "task_id": "task-001",
  "role": "authority",
  "created_at": "2026-04-09T14:00:28Z"
}
