{
  "summary": "Structural review of CLI path traversal defense across 7 command files. All user-supplied identifiers validated with validateIdentifier(). All write paths checked with assertContainedIn() anchored to missionDir or geasDir as appropriate. lock.ts correctly omits assertContainedIn since paths are fixed. No remaining .replace sanitization on user input (reject-not-sanitize pattern upheld). VALID_PHASES enum matches protocol. All imports present. No edge cases missed -- readdirSync-derived IDs in decision list are filesystem-sourced not user-supplied, lock targets are data not path segments.",
  "verdict": "approved",
  "concerns": [],
  "version": "1.0",
  "agent": "design-authority-review",
  "task_id": "task-001",
  "role": "reviewer",
  "created_at": "2026-04-09T13:55:39Z"
}
