{
  "summary": "Verified: /pivot-protocol replaced with /geas:vote-round in verify-fix-loop and evidence-gate, CLAUDE.md hybrid naming convention properly documented",
  "verdict": "approved",
  "concerns": [],
  "version": "1.0",
  "agent": "design_authority",
  "task_id": "task-002",
  "role": "reviewer",
  "created_at": "2026-04-09T13:06:51Z"
}
