{
  "summary": "Created /geas:help skill with usage guide covering all available commands, 4-phase workflow explanation, agent model description, and getting started guide",
  "files_changed": [
    "plugin/skills/help/SKILL.md"
  ],
  "version": "1.0",
  "agent": "software-engineer",
  "task_id": "task-006",
  "role": "implementer",
  "created_at": "2026-04-09T14:20:41Z"
}
