{
  "summary": "Verified all ACs met",
  "verdict": "pass",
  "criteria_results": [
    {
      "criterion": "io_sections",
      "passed": true
    },
    {
      "criterion": "examples",
      "passed": true
    },
    {
      "criterion": "line_count",
      "passed": true
    }
  ],
  "version": "1.0",
  "agent": "qa-engineer",
  "task_id": "task-009",
  "role": "tester",
  "created_at": "2026-04-09T14:30:26Z"
}
