{
  "summary": "Changed all agentType enum values from underscores to hyphens across 10 schema files, 13 agent YAML files, profiles.json, 2 CLI source files, and integration tests. Build, typecheck, and all 68 integration tests pass. Zero grep hits for underscore agent types.",
  "files_changed": [
    "docs/protocol/schemas/_defs.schema.json",
    "docs/protocol/schemas/vote-round.schema.json",
    "docs/protocol/schemas/rules-update.schema.json",
    "docs/protocol/schemas/phase-review.schema.json",
    "docs/protocol/schemas/gap-assessment.schema.json",
    "docs/protocol/schemas/design-brief.schema.json",
    "docs/protocol/schemas/debt-register.schema.json",
    "docs/protocol/schemas/health-check.schema.json",
    "docs/protocol/schemas/run-state.schema.json",
    "docs/protocol/schemas/policy-override.schema.json",
    "plugin/agents/**/*.md",
    "plugin/skills/mission/references/profiles.json",
    "plugin/cli/src/commands/health.ts",
    "plugin/cli/src/commands/debt.ts",
    "plugin/cli/test/integration.js"
  ],
  "version": "1.0",
  "agent": "software-engineer",
  "task_id": "task-002",
  "role": "implementer",
  "created_at": "2026-04-09T14:08:20Z"
}
