{
  "summary": "Build 68/68 pass. Mode selection (lightweight/standard/full_depth) present in intake/SKILL.md. Verified.",
  "verdict": "pass",
  "criteria_results": [
    {
      "criterion": "mode_selection_in_intake",
      "passed": true
    },
    {
      "criterion": "build_and_tests",
      "passed": true
    }
  ],
  "version": "1.0",
  "agent": "qa-engineer",
  "task_id": "task-005",
  "role": "tester",
  "created_at": "2026-04-09T14:22:34Z"
}
